79,카페,엣백,서울 동작구 흑석로 중앙대학교 310관 1층,"경영경제관 1층에 위치한 카페. 교내에 위치한 카페답게 양과 맛에 비해 저렴한 가격이 장점이며, 스무디 종류가 특히 맛있다. 사이드 종류도 다양하게 준비되어 있어 수업 전에 간단하게 배를 채우기에도 좋다.",http://blog.naver.com/ostr0826/220991737274
80,카페,요거프레소,서울 동작구 흑석로8길 1,"학교 근처에서도 다양한 과일이 올라간 요거트들을 즐길 수 있는 곳이다. 망고, 딸기 등의 요거트 메뉴가 유명하며, 가격은 조금 있지만 올라가는 토핑들의 양을 보면 오히려 저렴한 수준. 좌석도 마련되어 있어 카페에 앉아 공부를 하기에도 편하다.",
81,카페,탐앤탐스,서울 동작구 흑석로 105,좌석이 많이 마련되어 있고 넓어 무난하게 들리기에 좋다. 카페 내에 흡연실이 마련되어 있다.,
82,카페,오후홍콩,서울 동작구 흑석로13가길 29,"중앙대학교 졸업생들이 창업하여 화제가 되었던 학교 근처 조용한 카페. 골목 구석에 위치하여 처음 가면 다소 찾기는 어려우나, 깔끔한 분위기와 느낌 있는 외관이 특징이다. 좌석이 많지는 않은 편이며, 커피 종류와 오후홍콩에서만 맛볼 수 있는 파인애플 번이 유명하다. 빵이 나오는 시간인 12시 이후에 방문할 것을 추천.",
83,카페,베브릿지,서울 동작구 흑석로9길 4,기존 카페들과는 다르게 각국의 다양한 음료들을 판매한다는 점이 특징이다. 카페의 테마가 확실한 만큼 카페 내부의 인테리어도 특색 있는 편이다. 난생 처음 보는 메뉴들이 많이 있으니 직원들의 추천을 받는 것도 한 방법. 사이즈는 물론이고 당도와 토핑도 조절할 수 있다.,
84,카페,스트라다,서울 동작구 흑석로 84 중앙대학교 106관 2층,"의학관 건물 지하에 위치한 스트라다 커피. 직원들이 많아 주문한 음료가 빨리 나오는 편이며, 쿠키바닐라버블티와 죠리퐁스무디가 가장 인기 있는 메뉴이다.",
85,카페,,,,
86,술집,봉구비어,서울 동작구 흑석로 115,"중앙대 정문에서 흑석역으로 길을 따라가면 보이는 스몰비어 전문점이다. 1층에 아담한 분위기로 소소하게 테이블이 마련되어 있으며, 일반적으로는 소규모의 인원들이 가기에 알맞다. 만년 스테디셀러인 크림생맥주와 감자튀김, 치즈스틱이 간단하게 맥주 한잔 하기에는 안성맞춤.",
87,술집,장독대,서울 동작구 흑석로 112,"파전과 막걸리를 주로 판매하는 전통 술집. 건물 내에 위치하여 있지만 아늑하고 주막 같은 특유의 분위기가 인상적이다. 다양한 종류의 파전을 주문할 수 있고, 막걸리에는 꿀을 추가하여 먹기도 한다.",
88,술집,맥주창고,서울 동작구 흑석로 110,"세계의 다양한 맥주들을 구비해놓고 손님들이 자유롭게 마시도록 세팅되어 있는 곳이다. 간단한 안주 종류를 팔긴 하지만, 외부 음식을 가지고 오거나 배달을 시키는 것도 가능하여 많은 사람들이 찾는다. 흡연 부스도 마련되어 있다.",
89,술집,캐빈,서울 동작구 흑석로7길 3,"중앙대 학생들이 사랑하는 세계 맥주 및 생맥주 전문점. 지하에 위치하여 입학 초반에는 이런 가게가 있는지도 모르는 새내기들이 대부분이지만, 특유의 분위기와 친절함으로 단골 손님이 굉장히 많다. 맥주 종류가 다양하지만 그중에서도 생맥주가 유명함.",
90,술집,리얼후라이,서울 동작구 흑석로 113,"흑석의 치킨 맛집이라고 불리는 곳. 일반 치킨들보다도 오미치킨, 까르보텐더 치킨, 닭똥집 후라이드 등의 이색적인 메뉴가 인기를 끌고 있다. 생맥주를 청결하게 관리하기로도 유명하여 치맥 하기에 좋은 곳.",
91,술집,곱창고,서울 동작구 서달로14길 8,"흑석시장 입구에 위치하고 있는 곱창 가게. 체인점이라 무난하게 찾을 때 편하다. 9900원이라는 비교적 저렴한 가격에 곱창모듬을 즐길 수 있다. 모든 곱창은 초벌이 된 상태로 나오며, 창고밥과 볶음밥 등 두 종류의 밥을 입맛에 맞게 주문 가능.",
92,술집,노랑통닭,서울 동작구 101-3,"내부는 아기자기하지만 가게가 넓어 테이블이 많다. 후라이드, 양념, 깐풍 치킨을 모두 맛볼 수 있는 순살 3종 세트가 인기 메뉴이며, 사이드 메뉴인 떡볶이의 감칠맛 또한 일품이므로 단체로 가면 꼭 시켜 먹어보기를 권장한다.",
93,술집,곱창의 전설,서울 동작구 흑석로 87,"많은 학생들이 곱창 하면 찾는 곳이다. 메인 메뉴는 통마늘알곱창이지만, 통마늘을 베이스로 치즈, 새우 등 다양한 토핑을 얹어서 먹을 수 있다는 것이 큰 장점. 조리 과정을 투명하게 볼 수 있어 청결 또한 걱정하지 않아도 된다. 특히 마지막에 먹는 볶음밥은 못 먹으면 아쉬울 정도의 맛이니 꼭 먹어 보기를 바란다.",
,,,,,
,,,,,
,,,,,
